{
  "schema_version": 1,
  "release_id": "sdaia-ai-engineer.bootstrap.v1",
  "track_id": "sdaia-ai-engineer",
  "status": "REVIEW",
  "item_version_ids": [
    "sdaia-ai-engineer.ai-software-engineering.api-versioning.definition.best-description.v1",
    "sdaia-ai-engineer.ai-software-engineering.api-versioning.definition.choose-correct.v1",
    "sdaia-ai-engineer.ai-software-engineering.api-versioning.definition.practical-meaning.v1",
    "sdaia-ai-engineer.ai-software-engineering.api-versioning.definition.technical-review.v1",
    "sdaia-ai-engineer.ai-software-engineering.api-versioning.reverse.describes-case.v1",
    "sdaia-ai-engineer.ai-software-engineering.api-versioning.reverse.recall-concept.v1",
    "sdaia-ai-engineer.ai-software-engineering.api-versioning.reverse.requirement.v1",
    "sdaia-ai-engineer.ai-software-engineering.api-versioning.reverse.team-choice.v1",
    "sdaia-ai-engineer.ai-software-engineering.async-i-o.definition.best-description.v1",
    "sdaia-ai-engineer.ai-software-engineering.async-i-o.definition.choose-correct.v1",
    "sdaia-ai-engineer.ai-software-engineering.async-i-o.definition.practical-meaning.v1",
    "sdaia-ai-engineer.ai-software-engineering.async-i-o.definition.technical-review.v1",
    "sdaia-ai-engineer.ai-software-engineering.async-i-o.reverse.describes-case.v1",
    "sdaia-ai-engineer.ai-software-engineering.async-i-o.reverse.recall-concept.v1",
    "sdaia-ai-engineer.ai-software-engineering.async-i-o.reverse.requirement.v1",
    "sdaia-ai-engineer.ai-software-engineering.async-i-o.reverse.team-choice.v1",
    "sdaia-ai-engineer.ai-software-engineering.authentication.definition.best-description.v1",
    "sdaia-ai-engineer.ai-software-engineering.authentication.definition.choose-correct.v1",
    "sdaia-ai-engineer.ai-software-engineering.authentication.definition.practical-meaning.v1",
    "sdaia-ai-engineer.ai-software-engineering.authentication.definition.technical-review.v1",
    "sdaia-ai-engineer.ai-software-engineering.authentication.reverse.describes-case.v1",
    "sdaia-ai-engineer.ai-software-engineering.authentication.reverse.recall-concept.v1",
    "sdaia-ai-engineer.ai-software-engineering.authentication.reverse.requirement.v1",
    "sdaia-ai-engineer.ai-software-engineering.authentication.reverse.team-choice.v1",
    "sdaia-ai-engineer.ai-software-engineering.authorization.definition.best-description.v1",
    "sdaia-ai-engineer.ai-software-engineering.authorization.definition.choose-correct.v1",
    "sdaia-ai-engineer.ai-software-engineering.authorization.definition.practical-meaning.v1",
    "sdaia-ai-engineer.ai-software-engineering.authorization.definition.technical-review.v1",
    "sdaia-ai-engineer.ai-software-engineering.authorization.reverse.describes-case.v1",
    "sdaia-ai-engineer.ai-software-engineering.authorization.reverse.recall-concept.v1",
    "sdaia-ai-engineer.ai-software-engineering.authorization.reverse.requirement.v1",
    "sdaia-ai-engineer.ai-software-engineering.authorization.reverse.team-choice.v1",
    "sdaia-ai-engineer.ai-software-engineering.caching.definition.best-description.v1",
    "sdaia-ai-engineer.ai-software-engineering.caching.definition.choose-correct.v1",
    "sdaia-ai-engineer.ai-software-engineering.caching.definition.practical-meaning.v1",
    "sdaia-ai-engineer.ai-software-engineering.caching.definition.technical-review.v1",
    "sdaia-ai-engineer.ai-software-engineering.caching.reverse.describes-case.v1",
    "sdaia-ai-engineer.ai-software-engineering.caching.reverse.recall-concept.v1",
    "sdaia-ai-engineer.ai-software-engineering.caching.reverse.requirement.v1",
    "sdaia-ai-engineer.ai-software-engineering.caching.reverse.team-choice.v1",
    "sdaia-ai-engineer.ai-software-engineering.circuit-breaker.definition.best-description.v1",
    "sdaia-ai-engineer.ai-software-engineering.circuit-breaker.definition.choose-correct.v1",
    "sdaia-ai-engineer.ai-software-engineering.circuit-breaker.definition.practical-meaning.v1",
    "sdaia-ai-engineer.ai-software-engineering.circuit-breaker.definition.technical-review.v1",
    "sdaia-ai-engineer.ai-software-engineering.circuit-breaker.reverse.describes-case.v1",
    "sdaia-ai-engineer.ai-software-engineering.circuit-breaker.reverse.recall-concept.v1",
    "sdaia-ai-engineer.ai-software-engineering.circuit-breaker.reverse.requirement.v1",
    "sdaia-ai-engineer.ai-software-engineering.circuit-breaker.reverse.team-choice.v1",
    "sdaia-ai-engineer.ai-software-engineering.contract-testing.definition.best-description.v1",
    "sdaia-ai-engineer.ai-software-engineering.contract-testing.definition.choose-correct.v1",
    "sdaia-ai-engineer.ai-software-engineering.contract-testing.definition.practical-meaning.v1",
    "sdaia-ai-engineer.ai-software-engineering.contract-testing.definition.technical-review.v1",
    "sdaia-ai-engineer.ai-software-engineering.contract-testing.reverse.describes-case.v1",
    "sdaia-ai-engineer.ai-software-engineering.contract-testing.reverse.recall-concept.v1",
    "sdaia-ai-engineer.ai-software-engineering.contract-testing.reverse.requirement.v1",
    "sdaia-ai-engineer.ai-software-engineering.contract-testing.reverse.team-choice.v1",
    "sdaia-ai-engineer.ai-software-engineering.distributed-tracing.definition.best-description.v1",
    "sdaia-ai-engineer.ai-software-engineering.distributed-tracing.definition.choose-correct.v1",
    "sdaia-ai-engineer.ai-software-engineering.distributed-tracing.definition.practical-meaning.v1",
    "sdaia-ai-engineer.ai-software-engineering.distributed-tracing.definition.technical-review.v1",
    "sdaia-ai-engineer.ai-software-engineering.distributed-tracing.reverse.describes-case.v1",
    "sdaia-ai-engineer.ai-software-engineering.distributed-tracing.reverse.recall-concept.v1",
    "sdaia-ai-engineer.ai-software-engineering.distributed-tracing.reverse.requirement.v1",
    "sdaia-ai-engineer.ai-software-engineering.distributed-tracing.reverse.team-choice.v1",
    "sdaia-ai-engineer.ai-software-engineering.exponential-backoff.definition.best-description.v1",
    "sdaia-ai-engineer.ai-software-engineering.exponential-backoff.definition.choose-correct.v1",
    "sdaia-ai-engineer.ai-software-engineering.exponential-backoff.definition.practical-meaning.v1",
    "sdaia-ai-engineer.ai-software-engineering.exponential-backoff.definition.technical-review.v1",
    "sdaia-ai-engineer.ai-software-engineering.exponential-backoff.reverse.describes-case.v1",
    "sdaia-ai-engineer.ai-software-engineering.exponential-backoff.reverse.recall-concept.v1",
    "sdaia-ai-engineer.ai-software-engineering.exponential-backoff.reverse.requirement.v1",
    "sdaia-ai-engineer.ai-software-engineering.exponential-backoff.reverse.team-choice.v1",
    "sdaia-ai-engineer.ai-software-engineering.graceful-degradation.definition.best-description.v1",
    "sdaia-ai-engineer.ai-software-engineering.graceful-degradation.definition.choose-correct.v1",
    "sdaia-ai-engineer.ai-software-engineering.graceful-degradation.definition.practical-meaning.v1",
    "sdaia-ai-engineer.ai-software-engineering.graceful-degradation.definition.technical-review.v1",
    "sdaia-ai-engineer.ai-software-engineering.graceful-degradation.reverse.describes-case.v1",
    "sdaia-ai-engineer.ai-software-engineering.graceful-degradation.reverse.recall-concept.v1",
    "sdaia-ai-engineer.ai-software-engineering.graceful-degradation.reverse.requirement.v1",
    "sdaia-ai-engineer.ai-software-engineering.graceful-degradation.reverse.team-choice.v1",
    "sdaia-ai-engineer.ai-software-engineering.idempotency.definition.best-description.v1",
    "sdaia-ai-engineer.ai-software-engineering.idempotency.definition.choose-correct.v1",
    "sdaia-ai-engineer.ai-software-engineering.idempotency.definition.practical-meaning.v1",
    "sdaia-ai-engineer.ai-software-engineering.idempotency.definition.technical-review.v1",
    "sdaia-ai-engineer.ai-software-engineering.idempotency.reverse.describes-case.v1",
    "sdaia-ai-engineer.ai-software-engineering.idempotency.reverse.recall-concept.v1",
    "sdaia-ai-engineer.ai-software-engineering.idempotency.reverse.requirement.v1",
    "sdaia-ai-engineer.ai-software-engineering.idempotency.reverse.team-choice.v1",
    "sdaia-ai-engineer.ai-software-engineering.integration-testing.definition.best-description.v1",
    "sdaia-ai-engineer.ai-software-engineering.integration-testing.definition.choose-correct.v1",
    "sdaia-ai-engineer.ai-software-engineering.integration-testing.definition.practical-meaning.v1",
    "sdaia-ai-engineer.ai-software-engineering.integration-testing.definition.technical-review.v1",
    "sdaia-ai-engineer.ai-software-engineering.integration-testing.reverse.describes-case.v1",
    "sdaia-ai-engineer.ai-software-engineering.integration-testing.reverse.recall-concept.v1",
    "sdaia-ai-engineer.ai-software-engineering.integration-testing.reverse.requirement.v1",
    "sdaia-ai-engineer.ai-software-engineering.integration-testing.reverse.team-choice.v1",
    "sdaia-ai-engineer.ai-software-engineering.queue.definition.best-description.v1",
    "sdaia-ai-engineer.ai-software-engineering.queue.definition.choose-correct.v1",
    "sdaia-ai-engineer.ai-software-engineering.queue.definition.practical-meaning.v1",
    "sdaia-ai-engineer.ai-software-engineering.queue.definition.technical-review.v1",
    "sdaia-ai-engineer.ai-software-engineering.queue.reverse.describes-case.v1",
    "sdaia-ai-engineer.ai-software-engineering.queue.reverse.recall-concept.v1",
    "sdaia-ai-engineer.ai-software-engineering.queue.reverse.requirement.v1",
    "sdaia-ai-engineer.ai-software-engineering.queue.reverse.team-choice.v1",
    "sdaia-ai-engineer.ai-software-engineering.rate-limiting.definition.best-description.v1",
    "sdaia-ai-engineer.ai-software-engineering.rate-limiting.definition.choose-correct.v1",
    "sdaia-ai-engineer.ai-software-engineering.rate-limiting.definition.practical-meaning.v1",